{
  "$schema": "https://json-schema.org/draft/2020-12/schema",
  "$id": "https://koreapoorboy-coder.github.io/univ-search/math-weakness-engine/data/ai_bridge/verification_answer_review_schema.v1.json",
  "title": "Math Verification Answer Review",
  "type": "object",
  "additionalProperties": false,
  "required": [
    "review_id",
    "overall_result",
    "question_reviews",
    "final_instruction"
  ],
  "properties": {
    "review_id": {
      "type": "string"
    },
    "overall_result": {
      "type": "object",
      "additionalProperties": false,
      "required": [
        "level",
        "score",
        "decision"
      ],
      "properties": {
        "level": {
          "type": "string",
          "enum": [
            "A",
            "B",
            "C",
            "D"
          ]
        },
        "score": {
          "type": "number"
        },
        "decision": {
          "type": "string",
          "enum": [
            "understood",
            "partial_understanding",
            "memorized_only",
            "needs_relearning"
          ]
        },
        "summary": {
          "type": "string"
        }
      }
    },
    "question_reviews": {
      "type": "array",
      "items": {
        "type": "object",
        "additionalProperties": false,
        "required": [
          "question_id",
          "status",
          "score",
          "confirmed_understanding",
          "missing_elements",
          "feedback"
        ],
        "properties": {
          "question_id": {
            "type": "string"
          },
          "status": {
            "type": "string",
            "enum": [
              "correct",
              "partial",
              "incorrect",
              "unanswered"
            ]
          },
          "score": {
            "type": "number"
          },
          "confirmed_understanding": {
            "type": "array",
            "items": {
              "type": "string"
            }
          },
          "missing_elements": {
            "type": "array",
            "items": {
              "type": "string"
            }
          },
          "misconceptions": {
            "type": "array",
            "items": {
              "type": "string"
            }
          },
          "feedback": {
            "type": "string"
          }
        }
      }
    },
    "final_instruction": {
      "type": "object",
      "additionalProperties": false,
      "required": [
        "student_message",
        "teacher_action",
        "redo_tasks",
        "parent_message"
      ],
      "properties": {
        "student_message": {
          "type": "string"
        },
        "teacher_action": {
          "type": "string"
        },
        "redo_tasks": {
          "type": "array",
          "items": {
            "type": "string"
          }
        },
        "parent_message": {
          "type": "string"
        }
      }
    }
  }
}